[
  {
    "id": "7F91E5D8-36B6-EF11-88F8-6045BD56900E",
    "createdAt": "2024-12-09T07:06:56.510Z",
    "updatedAt": "2024-12-09T07:06:56.510Z",
    "name": "iPad Gen 10 10.9 inch 2022",
    "baseprice": 8790000,
    "description": "Kiểu dáng mỏng nhẹ, phong cách hiện đại - Khung viền và mặt lưng kim loại, mỏng chỉ 7 mm",
    "manufacturer": "Apple",
    "screenSize": 10.9,
    "screenType": "IPS LCD",
    "refreshRate": 60,
    "battery": 7587,
    "camera": "12MP, ƒ/1.8",
    "averageRating": 0,
    "imageProducts": [
      {
        "id": "8291E5D8-36B6-EF11-88F8-6045BD56900E",
        "createdAt": "2024-12-09T07:06:56.650Z",
        "updatedAt": "2024-12-09T07:06:56.650Z",
        "imageUrl": "https://ebkstoragea.blob.core.windows.net/fileupload/64274d6b-053d-462e-8d37-c6cfc1543e28.webp"
      },
      {
        "id": "8391E5D8-36B6-EF11-88F8-6045BD56900E",
        "createdAt": "2024-12-09T07:06:56.650Z",
        "updatedAt": "2024-12-09T07:06:56.650Z",
        "imageUrl": "https://ebkstoragea.blob.core.windows.net/fileupload/3b08cfa2-5079-4fc2-94c7-64bbc43bdb80.webp"
      },
      {
        "id": "8491E5D8-36B6-EF11-88F8-6045BD56900E",
        "createdAt": "2024-12-09T07:06:56.650Z",
        "updatedAt": "2024-12-09T07:06:56.650Z",
        "imageUrl": "https://ebkstoragea.blob.core.windows.net/fileupload/d4be723d-9f1a-49a8-bf90-4b893053efde.webp"
      }
    ],
    "category": {
      "id": "DEDB98F5-39B2-EF11-88F8-000D3A80414D",
      "title": "Phone, Tablet"
    },
    "inventory": "In Stock",
    "supplier": {
      "id": "865E00BB-E6B2-EF11-88F8-6045BD569740",
      "createdAt": "2024-12-05T01:55:53.136Z",
      "updatedAt": "2024-12-05T01:55:53.136Z",
      "name": "AppleStore",
      "address": "Ho Chi Minh City",
      "email": "Apple@supply.com",
      "phone": "01234567890"
    },
    "reviews": [],
    "variants": [
      {
        "id": "8091E5D8-36B6-EF11-88F8-6045BD56900E",
        "createdAt": "2024-12-09T07:06:56.580Z",
        "updatedAt": "2024-12-09T07:06:56.580Z",
        "ram": 4,
        "rom": 256,
        "cpu": "Apple A14 Bionic",
        "color": "Yellow",
        "quantity": 10,
        "price": 12990000
      },
      {
        "id": "8191E5D8-36B6-EF11-88F8-6045BD56900E",
        "createdAt": "2024-12-09T07:06:56.580Z",
        "updatedAt": "2024-12-09T07:06:56.580Z",
        "ram": 4,
        "rom": 256,
        "cpu": "Apple A14 Bionic",
        "color": "Pink",
        "quantity": 2,
        "price": 12990000
      }
    ]
  },
  {
    "id": "44B247B5-38B6-EF11-88F8-6045BD56900E",
    "createdAt": "2024-12-09T07:20:15.750Z",
    "updatedAt": "2024-12-09T07:20:15.750Z",
    "name": "Mac mini M4 2024",
    "baseprice": 14990000,
    "description": "Thiết kế nhỏ gọn, tinh tế phù hợp với bất kỳ không gian làm việc nào.",
    "manufacturer": "Apple",
    "screenSize": 0,
    "screenType": "",
    "refreshRate": 0,
    "battery": 0,
    "camera": "",
    "averageRating": 0,
    "imageProducts": [
      {
        "id": "47B247B5-38B6-EF11-88F8-6045BD56900E",
        "createdAt": "2024-12-09T07:20:15.880Z",
        "updatedAt": "2024-12-09T07:20:15.880Z",
        "imageUrl": "https://ebkstoragea.blob.core.windows.net/fileupload/b1101906-c400-41d1-a068-acf8ccc40cc6.webp"
      },
      {
        "id": "48B247B5-38B6-EF11-88F8-6045BD56900E",
        "createdAt": "2024-12-09T07:20:15.880Z",
        "updatedAt": "2024-12-09T07:20:15.880Z",
        "imageUrl": "https://ebkstoragea.blob.core.windows.net/fileupload/73a1072c-2134-474c-8443-da2da6b0198b.webp"
      },
      {
        "id": "49B247B5-38B6-EF11-88F8-6045BD56900E",
        "createdAt": "2024-12-09T07:20:15.880Z",
        "updatedAt": "2024-12-09T07:20:15.880Z",
        "imageUrl": "https://ebkstoragea.blob.core.windows.net/fileupload/94b64f2b-b136-4672-baf2-0b70daed8af0.webp"
      }
    ],
    "category": {
      "id": "E4DB98F5-39B2-EF11-88F8-000D3A80414D",
      "title": "PC, Monitors, Printers"
    },
    "inventory": "In Stock",
    "supplier": {
      "id": "865E00BB-E6B2-EF11-88F8-6045BD569740",
      "createdAt": "2024-12-05T01:55:53.136Z",
      "updatedAt": "2024-12-05T01:55:53.136Z",
      "name": "AppleStore",
      "address": "Ho Chi Minh City",
      "email": "Apple@supply.com",
      "phone": "01234567890"
    },
    "reviews": [],
    "variants": [
      {
        "id": "45B247B5-38B6-EF11-88F8-6045BD56900E",
        "createdAt": "2024-12-09T07:20:15.820Z",
        "updatedAt": "2024-12-09T07:20:15.820Z",
        "ram": 16,
        "rom": 512,
        "cpu": "Apple M4",
        "color": "Silver",
        "quantity": 2,
        "price": 19990000
      },
      {
        "id": "46B247B5-38B6-EF11-88F8-6045BD56900E",
        "createdAt": "2024-12-09T07:20:15.820Z",
        "updatedAt": "2024-12-09T07:20:15.820Z",
        "ram": 24,
        "rom": 512,
        "cpu": "Apple M4",
        "color": "Silver",
        "quantity": 3,
        "price": 19990000
      }
    ]
  },
  {
    "id": "1815A64C-39B6-EF11-88F8-6045BD56900E",
    "createdAt": "2024-12-09T07:24:29.706Z",
    "updatedAt": "2024-12-09T07:24:29.706Z",
    "name": "Macbook Pro 14 M4",
    "baseprice": 39990000,
    "description": "Cung cấp hiệu năng mạnh mẽ với 10 nhân CPU và 10 nhân GPU, đáp ứng tốt nhu cầu công việc hàng ngày và các tác vụ sáng tạo cơ bản.",
    "manufacturer": "Apple",
    "screenSize": 120,
    "screenType": "Liquid Rentina XDR",
    "refreshRate": 120,
    "battery": 55000,
    "camera": "",
    "averageRating": 0,
    "imageProducts": [
      {
        "id": "8F969E9A-39B6-EF11-88F8-6045BD56900E",
        "createdAt": "2024-12-09T07:26:40.526Z",
        "updatedAt": "2024-12-09T07:26:40.526Z",
        "imageUrl": "https://ebkstoragea.blob.core.windows.net/fileupload/76f1bbd1-3e81-4354-a201-00f0a5b6bccd.webp"
      },
      {
        "id": "90969E9A-39B6-EF11-88F8-6045BD56900E",
        "createdAt": "2024-12-09T07:26:40.770Z",
        "updatedAt": "2024-12-09T07:26:40.770Z",
        "imageUrl": "https://ebkstoragea.blob.core.windows.net/fileupload/d2bd6c4e-c768-4692-951a-e11fa0821d3a.webp"
      },
      {
        "id": "91969E9A-39B6-EF11-88F8-6045BD56900E",
        "createdAt": "2024-12-09T07:26:40.990Z",
        "updatedAt": "2024-12-09T07:26:40.990Z",
        "imageUrl": "https://ebkstoragea.blob.core.windows.net/fileupload/39068986-77d2-440c-81ea-24cd5005ef26.webp"
      }
    ],
    "category": {
      "id": "DFDB98F5-39B2-EF11-88F8-000D3A80414D",
      "title": "Laptop"
    },
    "inventory": "In Stock",
    "supplier": {
      "id": "865E00BB-E6B2-EF11-88F8-6045BD569740",
      "createdAt": "2024-12-05T01:55:53.136Z",
      "updatedAt": "2024-12-05T01:55:53.136Z",
      "name": "AppleStore",
      "address": "Ho Chi Minh City",
      "email": "Apple@supply.com",
      "phone": "01234567890"
    },
    "reviews": [],
    "variants": [
      {
        "id": "1915A64C-39B6-EF11-88F8-6045BD56900E",
        "createdAt": "2024-12-09T07:24:29.776Z",
        "updatedAt": "2024-12-09T07:24:29.776Z",
        "ram": 16,
        "rom": 512,
        "cpu": "10 CORE M4",
        "color": "Black",
        "quantity": 2,
        "price": 39990000
      },
      {
        "id": "1A15A64C-39B6-EF11-88F8-6045BD56900E",
        "createdAt": "2024-12-09T07:24:29.776Z",
        "updatedAt": "2024-12-09T07:24:29.776Z",
        "ram": 24,
        "rom": 256,
        "cpu": "10 CORE M4",
        "color": "Silver",
        "quantity": 4,
        "price": 44990000
      },
      {
        "id": "1B15A64C-39B6-EF11-88F8-6045BD56900E",
        "createdAt": "2024-12-09T07:24:29.776Z",
        "updatedAt": "2024-12-09T07:24:29.776Z",
        "ram": 24,
        "rom": 256,
        "cpu": "12 CORE M4",
        "color": "Black",
        "quantity": 5,
        "price": 44990000
      }
    ]
  },
  {
    "id": "A6696B79-42B6-EF11-88F8-6045BD56900E",
    "createdAt": "2024-12-09T08:30:10.290Z",
    "updatedAt": "2024-12-09T08:30:10.290Z",
    "name": "Apple MacBook Air M2",
    "baseprice": 22290000,
    "description": "Macbook Air M2 2022 với thiết kế sang trọng, vẻ ngoài siêu mỏng đầy lịch lãm. Đa nhiệm mượt mà - Ram 8GB, SSD 256GB cho phép vừa làm việc, vừa nghe nhạc.",
    "manufacturer": "Apple",
    "screenSize": 13.6,
    "screenType": "Liquid Retina Display",
    "refreshRate": 120,
    "battery": 55600,
    "camera": "",
    "averageRating": 0,
    "imageProducts": [
      {
        "id": "AA696B79-42B6-EF11-88F8-6045BD56900E",
        "createdAt": "2024-12-09T08:30:10.430Z",
        "updatedAt": "2024-12-09T08:30:10.430Z",
        "imageUrl": "https://ebkstoragea.blob.core.windows.net/fileupload/e2ab5c31-fc1e-4807-850d-ab0cb3f00c94.webp"
      },
      {
        "id": "AB696B79-42B6-EF11-88F8-6045BD56900E",
        "createdAt": "2024-12-09T08:30:10.430Z",
        "updatedAt": "2024-12-09T08:30:10.430Z",
        "imageUrl": "https://ebkstoragea.blob.core.windows.net/fileupload/bb36cfe1-c928-48b1-a22e-138d133c3588.webp"
      },
      {
        "id": "AC696B79-42B6-EF11-88F8-6045BD56900E",
        "createdAt": "2024-12-09T08:30:10.430Z",
        "updatedAt": "2024-12-09T08:30:10.430Z",
        "imageUrl": "https://ebkstoragea.blob.core.windows.net/fileupload/386a5da4-490f-4039-9573-2f68d1bdd464.webp"
      },
      {
        "id": "AD696B79-42B6-EF11-88F8-6045BD56900E",
        "createdAt": "2024-12-09T08:30:10.430Z",
        "updatedAt": "2024-12-09T08:30:10.430Z",
        "imageUrl": "https://ebkstoragea.blob.core.windows.net/fileupload/467745eb-d490-4295-b5f5-0b8d5aba469d.webp"
      }
    ],
    "category": {
      "id": "DFDB98F5-39B2-EF11-88F8-000D3A80414D",
      "title": "Laptop"
    },
    "inventory": "In Stock",
    "supplier": {
      "id": "865E00BB-E6B2-EF11-88F8-6045BD569740",
      "createdAt": "2024-12-05T01:55:53.136Z",
      "updatedAt": "2024-12-05T01:55:53.136Z",
      "name": "AppleStore",
      "address": "Ho Chi Minh City",
      "email": "Apple@supply.com",
      "phone": "01234567890"
    },
    "reviews": [],